{
  "id": "00000000-0000-4000-8000-000000000008",
  "insight_id": "00000000-0000-4000-8000-000000000002",
  "status": "refusal",
  "answer": null,
  "claims": [],
  "evidence": {},
  "missing": [],
  "refusal_reason": "Вопрос не относится к карточке и компании.",
  "suggested_questions": [
    "Почему событие относится к нашей компании?",
    "Что нужно проверить в договоре?",
    "Каких данных не хватает?"
  ],
  "questions_remaining": 8
}